{
  "schema_version": "1.0",
  "event_id": "EVT-20260827034134715-RS8VX0",
  "event_type": "status_updated",
  "occurred_at": "2026-08-27T03:41:34.715Z",
  "actor": {
    "role": "controller",
    "session": "controller-mode-activation"
  },
  "summary": "Mode Activation non-deferred pre-Candidate canary Gate PASS; Candidate preparation authorized by existing user instruction",
  "status_after": "active",
  "evidence_refs": []
}
