{
  "schema_version": "1.0",
  "event_id": "EVT-20260820114932622-IHS1HO",
  "event_type": "validation_changed",
  "occurred_at": "2026-08-20T11:49:32.622Z",
  "actor": {
    "role": "controller",
    "session": "task004-test-revision-001"
  },
  "summary": "Controller 拒绝首轮 TASK-004 RED package 的三个 Artifact 证据缺口；Test Revision 001 已派发。",
  "status_after": "active",
  "evidence_refs": []
}
