{
  "schema_version": "1.0",
  "event_id": "EVT-20260821064509284-OFAPBF",
  "event_type": "phase_changed",
  "occurred_at": "2026-08-21T06:45:09.284Z",
  "actor": {
    "role": "controller",
    "session": "controller-task010-r3"
  },
  "summary": "TASK-010 R3 Phase-B Test/RED active",
  "status_after": "active",
  "evidence_refs": []
}
