{
  "schema_version": "1.0",
  "event_id": "EVT-20260821152947262-Y7I6A7",
  "event_type": "validation_changed",
  "occurred_at": "2026-08-21T15:29:47.262Z",
  "actor": {
    "role": "controller",
    "session": "controller-cvr-tdd-ready"
  },
  "summary": "CVR签发TDD_READY并开启Worker Gate。",
  "status_after": "active",
  "evidence_refs": []
}
