{
  "schema_version": "1.0",
  "event_id": "EVT-20260930105616223-S40XWL",
  "event_type": "status_updated",
  "occurred_at": "2026-09-30T10:56:16.223Z",
  "actor": {
    "role": "controller",
    "session": "change-002-engineering-controller"
  },
  "summary": "交付测试修正及独立复核PASS，准备更新PR46",
  "status_after": "validating",
  "evidence_refs": []
}
