{
  "schema_version": "1.0",
  "event_id": "EVT-20260928015304385-8MZ9LW",
  "event_type": "phase_changed",
  "occurred_at": "2026-09-28T01:53:04.385Z",
  "actor": {
    "role": "controller",
    "session": "01a0b45a-13ad-7b92-a2b4-cdde980558e1"
  },
  "summary": "用户授权原Change内部安装补充及固定Python来源，原验收历史保留；开始连续工程，不代表新包PASS",
  "status_after": "active",
  "evidence_refs": []
}
