{
  "schema_version": "1.0",
  "event_id": "EVT-20260930135805709-EEFZTN",
  "event_type": "archived",
  "occurred_at": "2026-09-30T13:58:05.709Z",
  "actor": {
    "role": "controller",
    "session": "desktop-dev-engineering-controller"
  },
  "summary": "PR48已合并并main干净读回；开发模式工程补充归档完成，DMG011未变",
  "status_after": "complete",
  "evidence_refs": []
}
