{
  "schema_version": "1.0",
  "event_id": "EVT-20261002100716117-WRYZ78",
  "event_type": "status_updated",
  "occurred_at": "2026-10-02T10:07:16.117Z",
  "actor": {
    "role": "controller",
    "session": "change-004"
  },
  "summary": "隔离验证结束：E1 PASS，布局补验 PASS；E2桌面服务限制已取证，工程接受仍BLOCKED。",
  "status_after": "blocked",
  "evidence_refs": []
}
