{
  "schema_version": "1.0",
  "event_id": "EVT-20260821071834808-QJJNND",
  "event_type": "phase_changed",
  "occurred_at": "2026-08-21T07:18:34.808Z",
  "actor": {
    "role": "controller",
    "session": "controller-task010-r3"
  },
  "summary": "TASK-010 R3 B2d-A共享Artifact signal focused GREEN 1/1",
  "status_after": "active",
  "evidence_refs": []
}
